<?xml version="1.0" encoding="UTF-8"?>

<!--

Authors : Zeinabou Bissi KONE - Sicong XU

-->

<patient xmlns:xsi='http://www.w3.org/2001/XMLSchema-instance'
         xmlns:act="http://www.ujf-grenoble.fr/l3miage/actes" 
         xmlns='http://www.ujf-grenoble.fr/l3miage/medical'
         xsi:schemaLocation='http://www.ujf-grenoble.fr/l3miage/medical ../xsd/patient.xsd'>
    <nom>Alécole</nom>
    <prénom>Yvon</prénom>
    <sexe>M</sexe>
    <naissance>1998-08-02</naissance>
    <numéro>198081305545892</numéro>
    <adresse>
        <étage>6</étage>
        <numéro>50</numéro>
        <rue>avenue Félix Viallet</rue>
        <ville>Grenoble</ville>
        <codePostal>38031</codePostal>
    </adresse>
    <visite date="2015-12-08">
        <intervenant>
            <nom>Fréchie</nom>
            <prénom>Sarah</prénom>
        </intervenant>
        <acte>
            Injection sous-cutanée.
        </acte>
    </visite>
</patient>
